"id_str","datetime","date","text"
"980964100502118400",2018-04-03 02:24:01,2018-04-03,"39% of my nominations, including Diplomats to foreign lands, have not been confirmed due to Democrat obstruction and delay. At this rate, it would take more than 7 years before I am allowed to have these great people start working. Never happened before. Disgraceful!"
"979449770640015361",2018-03-29 22:06:37,2018-03-29,"Washington spent trillions building up foreign countries while allowing OUR OWN infrastructure to fall into a state of total disrepair. No more! It's time to REBUILD, and we will do it with American WORKERS, American GRIT, and American PRIDE! https://t.co/Q9rPZi2D2s"
"984032798821568513",2018-04-11 13:37:56,2018-04-11,"Our relationship with Russia is worse now than it has ever been, and that includes the Cold War. There is no reason for this. Russia needs us to help with their economy, something that would be very easy to do, and we need all nations to work together. Stop the arms race?"
"980958298445885446",2018-04-03 02:00:58,2018-04-03,"As ridiculous as it sounds, the laws of our country do not easily allow us to send those crossing our Southern Border back where they came from. A whole big wasted procedure must take place. Mexico &amp; Canada have tough immigration laws, whereas ours are an Obama joke. ACT CONGRESS"
"980451155548491777",2018-04-01 16:25:46,2018-04-01,"Mexico is doing very little, if not NOTHING, at stopping people from flowing into Mexico through their Southern Border, and then into the U.S. They laugh at our dumb immigration laws. They must stop the big drug and people flows, or I will stop their cash cow, NAFTA. NEED WALL!"
"982218660788883457",2018-04-06 13:29:12,2018-04-06,"RT @realDonaldTrump: We are not in a trade war with China, that war was lost many years ago by the foolish, or incompetent, people who repr…"
"979326715272065024",2018-03-29 13:57:38,2018-03-29,"I have stated my concerns with Amazon long before the Election. Unlike others, they pay little or no taxes to state &amp; local governments, use our Postal System as their Delivery Boy (causing tremendous loss to the U.S.), and are putting many thousands of retailers out of business!"
"984204373105442816",2018-04-12 00:59:42,2018-04-11,"Honored to have Republican Congressional Leadership join me at the @WhiteHouse this evening. Lots to discuss as we continue MAKING AMERICA GREAT AGAIN! https://t.co/b9z5Nfdkcl"
"980832496005844993",2018-04-02 17:41:04,2018-04-02,"An honor to host the Annual @WhiteHouse Easter Egg Roll! https://t.co/bOMJRK8FyK"
"980961086546632705",2018-04-03 02:12:03,2018-04-03,"Honduras, Mexico and many other countries that the U.S. is very generous to, sends many of their people to our country through our WEAK IMMIGRATION POLICIES. Caravans are heading here. Must pass tough laws and build the WALL. Democrats allow open borders, drugs and crime!"
"984372760230154241",2018-04-12 12:08:49,2018-04-12,"California Governor Jerry Brown is doing the right thing and sending the National Guard to the Border. Thank you Jerry, good move for the safety of our Country!"
"980762392303980544",2018-04-02 13:02:30,2018-04-02,"Mexico has the absolute power not to let these large “Caravans” of people enter their country. They must stop them at their Northern Border, which they can do because their border laws work, not allow them to pass through into our country, which has no effective border laws....."
"984053549742067712",2018-04-11 15:00:23,2018-04-11,"Much of the bad blood with Russia is caused by the Fake &amp; Corrupt Russia Investigation, headed up by the all Democrat loyalists, or people that worked for Obama. Mueller is most conflicted of all (except Rosenstein who signed FISA &amp; Comey letter). No Collusion, so they go crazy!"
"981123772169191424",2018-04-03 12:58:30,2018-04-03,"Check out the fact that you can’t get a job at ratings challenged @CNN unless you state that you are totally anti-Trump? Little Jeff Zuker, whose job is in jeopardy, is not having much fun lately. They should clean up and strengthen CNN and get back to honest reporting!"
"981521901079146499",2018-04-04 15:20:31,2018-04-04,"When you’re already $500 Billion DOWN, you can’t lose!"
"981259962717388801",2018-04-03 21:59:40,2018-04-03,"WE WILL PROTECT OUR SOUTHERN BORDER! https://t.co/Z7fqQKcnez"
"982750459877380096",2018-04-08 00:42:22,2018-04-07,"Fire at Trump Tower is out. Very confined (well built building). Firemen (and women) did a great job. THANK YOU!"
"979447750529110017",2018-03-29 21:58:35,2018-03-29,"JOBS, JOBS, JOBS! Unemployment claims have fallen to a 45-year low. Together, we are making the economy great again! https://t.co/pN2TE5HDQm"
"980989085631225857",2018-04-03 04:03:18,2018-04-03,"#AutismAwarenessDay #LightItUpBlue https://t.co/JAzSE6yEes"
"981248899166932994",2018-04-03 21:15:42,2018-04-03,"Today, it was my honor to welcome Estonia President @KerstiKaljulaid, Lithuania President @Grybauskaite_LT, and Latvia President @Vejonis to the @WhiteHouse. Congratulations on your 100th anniversaries of independence! #BalticSummit: https://t.co/XAchZ3zUSe https://t.co/RRftyTGEvb"
"983423715332558848",2018-04-09 21:17:39,2018-04-09,"The Democrats are not doing what’s right for our country. I will not rest until we have secured our borders and restored the rule of law! https://t.co/zKGgPlaadS"
"982680387116781568",2018-04-07 20:03:56,2018-04-07,"The United States hasn’t had a Trade Surplus with China in 40 years. They must end unfair trade, take down barriers and charge only Reciprocal Tariffs. The U.S. is losing $500 Billion a year, and has been losing Billions of Dollars for decades. Cannot continue!"
"984017894240604161",2018-04-11 12:38:42,2018-04-11,"So much Fake News about what is going on in the White House. Very calm and calculated with a big focus on open and fair trade with China, the coming North Korea meeting and, of course, the vicious gas attack in Syria. Feels great to have Bolton &amp; Larry K on board. I (we) are"
"982770847046922240",2018-04-08 02:03:23,2018-04-08,"While Security spending was somewhat more than his predecessor, Scott Pruitt has received death threats because of his bold actions at EPA. Record clean Air &amp; Water while saving USA Billions of Dollars. Rent was about market rate, travel expenses OK. Scott is doing a great job!"
"981492087328792577",2018-04-04 13:22:03,2018-04-04,"We are not in a trade war with China, that war was lost many years ago by the foolish, or incompetent, people who represented the U.S. Now we have a Trade Deficit of $500 Billion a year, with Intellectual Property Theft of another $300 Billion. We cannot let this continue!"
"981126375716409344",2018-04-03 13:08:51,2018-04-03,"Thank you to Rasmussen for the honest polling. Just hit 50%, which is higher than Cheatin’ Obama at the same time in his Administration."
"982292963492413442",2018-04-06 18:24:27,2018-04-06,"AMERICA IS OPEN FOR BUSINESS! https://t.co/5jxdojPZmN"
"979082457340407808",2018-03-28 21:47:02,2018-03-28,"Great briefing this afternoon on the start of our Southern Border WALL! https://t.co/pmCNoxxlkH"
"981287536520847360",2018-04-03 23:49:14,2018-04-03,"Was just briefed on the shooting at YouTube’s HQ in San Bruno, California. Our thoughts and prayers are with everybody involved. Thank you to our phenomenal Law Enforcement Officers and First Responders that are currently on the scene."
"983284198046826496",2018-04-09 12:03:16,2018-04-09,"When a car is sent to the United States from China, there is a Tariff to be paid of 2 1/2%. When a car is sent to China from the United States, there is a Tariff to be paid of 25%. Does that sound like free or fair trade.  No, it sounds like STUPID TRADE -  going on for years!"
"984022625440747520",2018-04-11 12:57:30,2018-04-11,"Russia vows to shoot down any and all missiles fired at Syria. Get ready Russia,  because they will be coming, nice and new and “smart!” You shouldn’t be partners with a Gas Killing Animal who kills his people and enjoys it!"
"981992052786425856",2018-04-05 22:28:44,2018-04-05,"Thank you @WVGovernor Jim Justice. It was my great honor to be with the amazing people of West Virginia today! #MAGA https://t.co/IwPuQNadMM"
"980799183425802240",2018-04-02 15:28:42,2018-04-02,"So funny to watch Fake News Networks, among the most dishonest groups of people I have ever dealt with, criticize Sinclair Broadcasting for being biased. Sinclair is far superior to CNN and even more Fake NBC, which is a total joke."
"983662868540346371",2018-04-10 13:07:58,2018-04-10,"Attorney–client privilege is dead!"
"982353242196766720",2018-04-06 22:23:58,2018-04-06,"“BET founder: Trump's economy is bringing black workers back into the labor force” https://t.co/TtMDfi4bv0"
"984379918682394624",2018-04-12 12:37:16,2018-04-12,"Good luck to Mike Pompeo during his Confirmation Hearing today. He will be a great Secretary of State!"
"984066131303583746",2018-04-11 15:50:23,2018-04-11,"Speaker Paul Ryan is a truly good man, and while he will not be seeking re-election, he will leave a legacy of achievement that nobody can question. We are with you Paul!"
"981987882712883200",2018-04-05 22:12:10,2018-04-05,"Thanks to our historic TAX CUTS, America is open for business, and millions of American workers are seeing more take-home pay through higher wages, salaries and bonuses! https://t.co/0u3dpLJiV2"
"980065419632566272",2018-03-31 14:52:59,2018-03-31,"...does not include the Fake Washington Post, which is used as a “lobbyist” and should so  REGISTER. If the P.O. “increased its parcel rates, Amazon’s shipping costs would rise by $2.6 Billion.” This Post Office scam must stop. Amazon must pay real costs (and taxes) now!"
"977894983083708416",2018-03-25 15:08:27,2018-03-25,"Happy National #MedalOfHonorDay to our HEROES. We love you! https://t.co/6euI31R4Gz"
"974276383051583488",2018-03-15 14:29:25,2018-03-15,"We do have a Trade Deficit with Canada, as we do with almost all countries (some of them massive). P.M. Justin Trudeau of Canada, a very good guy, doesn’t like saying that Canada has a Surplus vs. the U.S.(negotiating), but they do...they almost all do...and that’s how I know!"
"974141083054690304",2018-03-15 05:31:47,2018-03-15,"Please join me with your thoughts and prayers for both aviators, their families and our incredible @USNavy. https://t.co/60bHhrp8Y1"
"978226474485534720",2018-03-26 13:05:40,2018-03-26,"The economy is looking really good. It has been many years that we have seen these kind of numbers. The underlying strength of companies has perhaps never been better."
"977585879651966980",2018-03-24 17:40:11,2018-03-24,"Our thoughts and prayers are with the victims of the horrible attack in France yesterday, and we grieve the nation’s loss. We also condemn the violent actions of the attacker and anyone who would provide him support. We are with you @EmmanuelMacron!"
"972506194978983937",2018-03-10 17:15:19,2018-03-10,"Chinese President XI JINPING and I spoke at length about the meeting with KIM JONG UN of North Korea. President XI told me he appreciates that the U.S. is working to solve the problem diplomatically rather than going with the ominous alternative. China continues to be helpful!"
"973920392543793154",2018-03-14 14:54:50,2018-03-14,"Five of our incredible @Cabinet Secretaries are testifying on the Hill this morning on the need to rebuild our Nation’s crumbling infrastructure. We need to build FAST &amp; we need to build for our FUTURE. Thank you @SenateCommerce for hosting this hearing! #InfrastructureInAmerica"
"975062797162811394",2018-03-17 18:34:21,2018-03-17,"The Fake News is beside themselves that McCabe was caught, called out and fired. How many hundreds of thousands of dollars was given to wife’s campaign by Crooked H friend, Terry M, who was also under investigation? How many lies? How many leaks? Comey knew it all, and much more!"
"974422724419444737",2018-03-16 00:10:56,2018-03-15,"Continuing to monitor the heartbreaking bridge collapse at FIU - so tragic. Many brave First Responders rushed in to save lives. Thank you for your courage. Praying this evening for all who are affected."
"978936058795757568",2018-03-28 12:05:18,2018-03-28,"For years and through many administrations, everyone said that peace and the denuclearization of the Korean Peninsula was not even a small possibility. Now there is a good chance that Kim Jong Un will do what is right for his people and for humanity. Look forward to our meeting!"
"978701966456082433",2018-03-27 20:35:06,2018-03-27,"I am very pleased to welcome the opioid memorial to the President's Park in April. I encourage all to visit and remember those who we have lost to this deadly epidemic. We will keep fighting until we defeat the opioid crisis! https://t.co/ZM7AYJyECr"
"976532956557737984",2018-03-21 19:56:14,2018-03-21,"I called President Putin of Russia to congratulate him on his election victory (in past, Obama called him also). The Fake News Media is crazed because they wanted me to excoriate him. They are wrong! Getting along with Russia (and others) is a good thing, not a bad thing......."
"972563247160274947",2018-03-10 21:02:02,2018-03-10,"In the first hours after hearing that North Korea’s leader wanted to meet with me to talk denuclearization and that missile launches will end, the press was startled &amp; amazed.They couldn’t believe it. But by the following morning the news became FAKE.They said so what, who cares!"
"977286489410240514",2018-03-23 21:50:30,2018-03-23,"Obama Administration legalized bump stocks. BAD IDEA. As I promised, today the Department of Justice will issue the rule banning BUMP STOCKS with a mandated comment period. We will BAN all devices that turn legal weapons into illegal machine guns."
"973185831547670529",2018-03-12 14:15:57,2018-03-12,"Very strong improvement and strengthening of background checks will be fully backed by White House. Legislation moving forward. Bump Stocks will soon be out. Highly trained expert teachers will be allowed to conceal carry, subject to State Law. Armed guards OK, deterrent!......."
"972622325454659585",2018-03-11 00:56:47,2018-03-10,"Join me LIVE in Moon Township, Pennsylvania at 7:00pmE. Great crowd for a #MAGA rally!
https://t.co/PYJNg0WGDL"
"977855968364171264",2018-03-25 12:33:25,2018-03-25,"Because of the $700 &amp; $716 Billion Dollars gotten to rebuild our Military, many jobs are created and our Military is again rich. Building a great Border Wall, with drugs (poison) and enemy combatants pouring into our Country, is all about National Defense. Build WALL through M!"
"972846978823610369",2018-03-11 15:49:29,2018-03-11,"The Democrats continue to Obstruct the confirmation of hundreds of good and talented people who are needed to run our government...A record in U.S. history. State Department, Ambassadors and many others are being slow walked. Senate must approve NOW!"
"977875057572745216",2018-03-25 13:49:16,2018-03-25,"....lawyer or law firm will take months to get up to speed (if for no other reason than they can bill more), which is unfair to our great country - and I am very happy with my existing team. Besides, there was NO COLLUSION with Russia, except by Crooked Hillary and the Dems!"
"975891861863829504",2018-03-20 01:28:45,2018-03-20,"The Democrats do not want to help DACA. Would be so easy to make a deal!"
"973580538358374402",2018-03-13 16:24:23,2018-03-13,"“According to the Center for Immigration Studies, the $18 billion wall will pay for itself by curbing the importation of crime, drugs and illegal immigrants who tend to go on the federal dole...” https://t.co/NdLC6jZwWE"
"973207890084401152",2018-03-12 15:43:36,2018-03-12,"The Pittsburgh Post Gazette just endorsed Rick Saccone for Congress. He will be much better for steel and business. Very strong on experience and what our Country needs. Lamb will always vote for Pelosi and Dems....Will raise taxes, weak on Crime and Border."
"976891486510907393",2018-03-22 19:40:54,2018-03-22,"As a candidate, I pledged that if elected I would use every lawful tool to combat unfair trade, protect American workers, and defend our national security.  Today, we took another critical step to fulfill that commitment. https://t.co/7NBI0Dibmx https://t.co/nmzqos3BUA"
"973716838889660416",2018-03-14 01:25:59,2018-03-14,"It was my great honor to deliver a message at the Marine Corps Air Station Miramar to our GREAT U.S. Military, straight from the heart of the American People: We support you, we thank you, we love you - and we will always have your back! https://t.co/oCt1nH3DON"
"975024181061541888",2018-03-17 16:00:54,2018-03-17,"Happy #StPatricksDay https://t.co/4vVsW2smhB"
"973907142649397251",2018-03-14 14:02:11,2018-03-14,"Hundreds of good people, including very important Ambassadors and Judges, are being blocked and/or slow walked by the Democrats in the Senate. Many important positions in Government are unfilled because of this obstruction. Worst in U.S. history!"
"972538115901607937",2018-03-10 19:22:10,2018-03-10,"Heading to Moon Township, Pennsylvania, to be with a really good person, State Representative Rick Saccone, who is running for Congress. Big &amp; happy crowd (why not, some of the best economic numbers ever). Rick will help me a lot. Also, tough on crime &amp; border. Loves 2nd A &amp; VETS"
"973360355790479361",2018-03-13 01:49:27,2018-03-13,"THE HOUSE INTELLIGENCE COMMITTEE HAS, AFTER A 14 MONTH LONG IN-DEPTH INVESTIGATION, FOUND NO EVIDENCE OF COLLUSION OR COORDINATION BETWEEN THE TRUMP CAMPAIGN AND RUSSIA TO INFLUENCE THE 2016 PRESIDENTIAL ELECTION."
"974341417509249024",2018-03-15 18:47:50,2018-03-15,"It was my honor to welcome Prime Minister Leo Varadkar of Ireland to the @WhiteHouse! https://t.co/ZT3WnIZR2L"
"977124622285066240",2018-03-23 11:07:18,2018-03-23,"House Intelligence Committee votes to release final report. FINDINGS: (1) No evidence provided of Collusion between Trump Campaign &amp; Russia. (2)  The Obama Administrations Post election response was insufficient. (3) Clapper provided inconsistent testimony on media contacts."
"978432632273948674",2018-03-27 02:44:52,2018-03-27,"Trade talks going on with numerous countries that, for many years, have not treated the United States fairly. In the end, all will be happy!"
"972829763067883523",2018-03-11 14:41:04,2018-03-11,"The Failing New York Times purposely wrote a false story stating that I am unhappy with my legal team on the Russia case and am going to add another lawyer to help out. Wrong. I am VERY happy with my lawyers, John Dowd, Ty Cobb and Jay Sekulow. They are doing a great job and....."
"976948306927607810",2018-03-22 23:26:41,2018-03-22,"I am pleased to announce that, effective 4/9/18, @AmbJohnBolton will be my new National Security Advisor. I am very thankful for the service of General H.R. McMaster who has done an outstanding job &amp; will always remain my friend. There will be an official contact handover on 4/9."
"975057131136274432",2018-03-17 18:11:50,2018-03-17,"As the House Intelligence Committee has concluded, there was no collusion between Russia and the Trump Campaign. As many are now finding out, however, there was tremendous leaking, lying and corruption at the highest levels of the FBI, Justice &amp; State. #DrainTheSwamp"
"972853747750711296",2018-03-11 16:16:22,2018-03-11,"Rasmussen and others have my approval ratings at around 50%, which is higher than Obama, and yet the political pundits love saying my approval ratings are “somewhat low.” They know they are lying when they say it. Turn off the show - FAKE NEWS!"
"977850135697911808",2018-03-25 12:10:14,2018-03-25,"France honors a great hero. Officer died after bravely swapping places with hostage in ISIS related terror attack. So much bravery around the world constantly fighting radical Islamic terrorism. Even stronger measures needed, especially at borders!"
"973199981292216320",2018-03-12 15:12:11,2018-03-12,"If schools are mandated to be gun free zones, violence and danger are given an open invitation to enter. Almost all school shootings are in gun free zones. Cowards will only go where there is no deterrent!"
"973719038982479872",2018-03-14 01:34:44,2018-03-14,"All across this nation, we pray for our country and we THANK GOD for our United States Marines! Thank you. God Bless You. And God Bless America! https://t.co/vKXBd0CGH1"
"972835128056664066",2018-03-11 15:02:23,2018-03-11,"The Republicans are 5-0 in recent Congressional races, a point which the Fake News Media continuously fails to mention. I backed and campaigned for all of the winners. They give me credit for one. Hopefully, Rick Saccone will be another big win on Tuesday."
"973171763835228162",2018-03-12 13:20:03,2018-03-12,"Secretary of Commerce Wilbur Ross will be speaking with representatives of the European Union about eliminating the large Tariffs and Barriers they use against the U.S.A. Not fair to our farmers and manufacturers."
"975720503997620224",2018-03-19 14:07:50,2018-03-19,"A total WITCH HUNT with massive conflicts of interest!"
"973931154796457984",2018-03-14 15:37:36,2018-03-14,"We cannot keep a blind eye to the rampant unfair trade practices against our Country!"
"978110975428657153",2018-03-26 05:26:43,2018-03-26,".@HowieCarrShow just wrote a book which everyone is talking about. He was a great help. He is a veteran journalist who had a great influence in NH and beyond. He calls it the most amazing political campaign of modern times. The book is called, “What Really Happened.” Enjoy! #MAGA https://t.co/jYhjpoJKHe"
"974032596563832832",2018-03-14 22:20:42,2018-03-14,"Thank you for hosting! #MAGA https://t.co/9pHH60DVlX"
"973568677189595136",2018-03-13 15:37:15,2018-03-13,"Heading to see the BORDER WALL prototypes in California! https://t.co/fU6Ukc271l"
"972500344197566465",2018-03-10 16:52:04,2018-03-10,"Congratulations to Kristian Saucier, a man who has served proudly in the Navy, on your newly found Freedom. Now you can go out and have the life you deserve!"
"977166887493799936",2018-03-23 13:55:15,2018-03-23,"I am considering a VETO of the Omnibus Spending Bill based on the fact that the 800,000 plus DACA recipients have been totally abandoned by the Democrats (not even mentioned in Bill) and the BORDER WALL, which is desperately needed for our National Defense, is not fully funded."
"978368319542702080",2018-03-26 22:29:19,2018-03-26,"Great news! #MAGA https://t.co/mRQGRJkozC"
"973581274215473153",2018-03-13 16:27:18,2018-03-13,"California’s sanctuary policies are illegal and unconstitutional and put the safety and security of our entire nation at risk. Thousands of dangerous &amp; violent criminal aliens are released as a result of sanctuary policies, set free to prey on innocent Americans. THIS MUST STOP!"
"974702363763232768",2018-03-16 18:42:07,2018-03-16,"“U.S. Consumer Confidence Hits 14-Year High” https://t.co/tXJsSRoM64"
"978249938743234560",2018-03-26 14:38:55,2018-03-26,"So much Fake News. Never been more voluminous or more inaccurate. But through it all, our country is doing great!"
"977872899792089088",2018-03-25 13:40:41,2018-03-25,"Many lawyers and top law firms want to represent me in the Russia case...don’t believe the Fake News narrative that it is hard to find a lawyer who wants to take this on. Fame &amp; fortune will NEVER be turned down by a lawyer, though some are conflicted. Problem is that a new......"
"974462702264479744",2018-03-16 02:49:47,2018-03-16,"“President Donald J. Trump Delivers Remarks at the Shamrock☘️Bowl Presentation by Prime Minister Varadkar in the East Room of the White House” 🇺🇸🇮🇪 https://t.co/ZbogpAE09g"
"974051595834003457",2018-03-14 23:36:12,2018-03-14,"Together, we are MAKING AMERICA GREAT AGAIN! https://t.co/CUutL5SZxQ"
"976770619424563200",2018-03-22 11:40:37,2018-03-22,"Remember when they were saying, during the campaign, that Donald Trump is giving great speeches and drawing big crowds, but he is spending much less money and not using social media as well as Crooked Hillary’s large and highly sophisticated staff. Well, not saying that anymore!"
"973909651065528320",2018-03-14 14:12:09,2018-03-14,"Perhaps at no time in history have the business fundamentals of U.S. companies been better than they are today!"
"977221676697079808",2018-03-23 17:32:58,2018-03-23,"News conference at the White House concerning the Omnibus Spending Bill.  1:00 P.M."
"976655903729610752",2018-03-22 04:04:47,2018-03-22,"Democrats refused to take care of DACA. Would have been so easy, but they just didn’t care. I had to fight for Military and start of Wall."
"972585290857672704",2018-03-10 22:29:37,2018-03-10,"The European Union, wonderful countries who treat the U.S. very badly on trade, are complaining about the tariffs on Steel &amp; Aluminum. If they drop their horrific barriers &amp; tariffs on U.S. products going in, we will likewise drop ours. Big Deficit. If not, we Tax Cars etc. FAIR!"
"976405122757558272",2018-03-21 11:28:16,2018-03-21,"AUSTIN BOMBING SUSPECT IS DEAD. Great job by law enforcement and all concerned!"
"976411208717950976",2018-03-21 11:52:27,2018-03-21,"Department of Justice should have urged the Supreme Court to at least hear the Drivers License case on illegal immigrants in Arizona. I agree with @LouDobbs. Should have sought review."
"975163071361683456",2018-03-18 01:12:48,2018-03-18,"The Mueller probe should never have been started in that there was no collusion and there was no crime. It was based on fraudulent activities and a Fake Dossier paid for by Crooked Hillary and the DNC, and improperly used in FISA COURT for surveillance of my campaign. WITCH HUNT!"
