"id_str","datetime","date","text"
"929511061954297857",2017-11-12 01:48:01,2017-11-12,"Why would Kim Jong-un insult me by calling me ""old,"" when I would NEVER call him ""short and fat?"" Oh well, I try so hard to be his friend - and maybe someday that will happen!"
"927397233741492225",2017-11-06 05:48:25,2017-11-06,"...Americans do what we do best: we pull together. We join hands. We lock arms and through the tears and the sadness, we stand strong... https://t.co/qkCPgtKGkA"
"926484660946862085",2017-11-03 17:22:11,2017-11-03,"JOBS, JOBS, JOBS! https://t.co/twUNktGbnb"
"929509950811881472",2017-11-12 01:43:36,2017-11-12,"Does the Fake News Media remember when Crooked Hillary Clinton, as Secretary of State, was begging Russia to be our friend with the misspelled reset button? Obama tried also, but he had zero chemistry with Putin."
"928769154345324544",2017-11-10 00:39:56,2017-11-09,"I don’t blame China, I blame the incompetence of past Admins for allowing China to take advantage of the U.S. on trade leading up to a point where the U.S. is losing $100's of billions. How can you blame China for taking advantage of people that had no clue? I would've done same!"
"930657178544984066",2017-11-15 05:42:16,2017-11-15,"Just returned from Asia after 12 very successful days. Great to be home!"
"930742569092435968",2017-11-15 11:21:35,2017-11-15,"RT @realDonaldTrump: Thank you to our GREAT Military/Veterans and @PacificCommand.

Remember #PearlHarbor. Remember the @USSArizona!

A day…"
"930751807101562881",2017-11-15 11:58:18,2017-11-15,"Thank you! https://t.co/EQMwv1XbiM"
"928124338343202816",2017-11-08 05:57:40,2017-11-08,"Leaving South Korea now heading to China. Looking very much forward to meeting and being with President Xi!"
"926707692395102219",2017-11-04 08:08:25,2017-11-04,"Thank you to our GREAT Military/Veterans and @PacificCommand.

Remember #PearlHarbor. Remember the @USSArizona!

A day I’ll never forget. https://t.co/CMkB0kTkSc"
"926973117708296192",2017-11-05 01:43:08,2017-11-05,"I am landing shortly. Can’t wait to be with our GREAT MILITARY. See you soon! https://t.co/AVLrrOxmm4"
"928286153672970240",2017-11-08 16:40:40,2017-11-08,"Looking forward to a full day of meetings with President Xi and our delegations tomorrow. THANK YOU for the beautiful welcome China! @FLOTUS Melania and I will never forget it! https://t.co/sQoUWIGAiQ"
"930087113764327424",2017-11-13 15:57:02,2017-11-13,"Happy to announce, I am nominating Alex Azar to be the next HHS Secretary. He will be a star for better healthcare and lower drug prices!"
"926415703476928512",2017-11-03 12:48:10,2017-11-03,"The real story on Collusion is in Donna B's new book. Crooked Hillary bought the DNC &amp; then stole the Democratic Primary from Crazy Bernie!"
"929670192434745344",2017-11-12 12:20:20,2017-11-12,"We had a wonderful visit to Vietnam, thank you President Tran Dai Quang! Heading to the #ASEANSummit 50th Anniv Gala in the Philippines now. https://t.co/WfSd8EE3Nm"
"928083235040579584",2017-11-08 03:14:20,2017-11-08,"Join me LIVE in South Korea🇺🇸🇰🇷
#NationalAssembly #POTUSinAsia 
➡️https://t.co/M3iEhPdkas https://t.co/hSxdtd2UnY"
"927852358209622016",2017-11-07 11:56:55,2017-11-07,".@EdWGillespie will totally turn around the high crime and poor economic performance of VA. MS-13 and crime will be gone. Vote today, ASAP!"
"927077305876434945",2017-11-05 08:37:08,2017-11-05,"Heading into the 12 days with great negotiating strength because of our tremendous economy. https://t.co/4HnXkR3EhW"
"930259298407419904",2017-11-14 03:21:14,2017-11-14,"Excited to be heading home to see the House pass a GREAT Tax Bill with the middle class getting big TAX CUTS!

#MakeAmericaGreatAgain🇺🇸"
"928325667556548608",2017-11-08 19:17:41,2017-11-08,"Congratulations to all of the ”DEPLORABLES” and the millions of people who gave us a MASSIVE (304-227) Electoral College landslide victory! https://t.co/7ifv5gT7Ur"
"929503641014112256",2017-11-12 01:18:32,2017-11-12,"When will all the haters and fools out there realize that having a good relationship with Russia is a good thing, not a bad thing. There always playing politics - bad for our country. I want to solve North Korea, Syria, Ukraine, terrorism, and Russia can greatly help!"
"930742717721739264",2017-11-15 11:22:10,2017-11-15,"RT @PChowka: Sean Hannity's Big Week - Top Ratings, Probing Reporting, and Let There Be Light at American Thinker https://t.co/b0RxpZd3Lb h…"
"926456069047582721",2017-11-03 15:28:34,2017-11-03,"Bernie Sanders supporters have every right to be apoplectic of the complete theft of the Dem primary by Crooked Hillary!"
"928267692645036032",2017-11-08 15:27:18,2017-11-08,"On behalf of @FLOTUS Melania and I, THANK YOU for an unforgettable afternoon and evening at the Forbidden City in Beijing, President Xi and Madame Peng Liyuan. We are looking forward to rejoining you tomorrow morning! https://t.co/ma0F7SHbVU"
"930089374187950081",2017-11-13 16:06:01,2017-11-13,"I am proud of the Rep. House &amp; Senate for working so hard on cutting taxes {&amp; reform.} We’re getting close! Now, how about ending the unfair &amp; highly unpopular Indiv Mandate in OCare &amp; reducing taxes even further? Cut top rate to 35% w/all of the rest going to middle income cuts?"
"926417546038923264",2017-11-03 12:55:29,2017-11-03,"Pocahontas just stated that the Democrats, lead by the legendary Crooked Hillary Clinton, rigged the Primaries! Lets go FBI &amp; Justice Dept."
"929492038231429120",2017-11-12 00:32:25,2017-11-11,"President Xi of China has stated that he is upping the sanctions against #NoKo. Said he wants them to denuclearize. Progress is being made."
"927265906086031363",2017-11-05 21:06:34,2017-11-05,"May God be w/ the people of Sutherland Springs, Texas. The FBI &amp; law enforcement are on the scene. I am monitoring the situation from Japan."
"927672843504177152",2017-11-07 00:03:35,2017-11-06,"I have great confidence in King Salman and the Crown Prince of Saudi Arabia, they know exactly what they are doing...."
"926419647708258304",2017-11-03 13:03:50,2017-11-03,"ISIS just claimed the Degenerate Animal who killed, and so badly wounded, the wonderful people on the West Side, was ""their soldier."" ....."
"930747213659197441",2017-11-15 11:40:02,2017-11-15,".@foxandfriends will be showing much of our successful trip to Asia, and the friendships &amp; benefits that will endure for years to come!"
"927906208203276288",2017-11-07 15:30:54,2017-11-07,"Franklin, such a great photo. 

HAPPY 99th BIRTHDAY to your father, @BillyGraham! https://t.co/l0c7RvvOa1"
"928519663780208640",2017-11-09 08:08:33,2017-11-09,"President Xi, thank you for such an incredible welcome ceremony. It was a truly memorable and impressive display! 📸https://t.co/J9x51h1LBe https://t.co/g4Z7mO5cV9"
"927847471321141249",2017-11-07 11:37:30,2017-11-07,"....is making. Working very hard on TAX CUTS for the middle class, companies and jobs!"
"927673257230327808",2017-11-07 00:05:14,2017-11-06,"....Some of those they are harshly treating have been “milking” their country for years!"
"930748627642998784",2017-11-15 11:45:39,2017-11-15,"While in the Philippines I was forced to watch @CNN, which I have not done in months, and again realized how bad, and FAKE, it is. Loser!"
"927844454957850625",2017-11-07 11:25:31,2017-11-07,"Thank you to President Moon of South Korea for the beautiful welcoming ceremony. It will always be remembered. https://t.co/bMvJz1iV2a"
"927645648685551616",2017-11-06 22:15:32,2017-11-06,"My visit to Japan and friendship with PM Abe will yield many benefits, for our great Country. Massive military &amp; energy orders happening+++!"
"927523335956848640",2017-11-06 14:09:30,2017-11-06,"#USA🇺🇸 #Japan🇯🇵 https://t.co/EvxFqAVnFS"
"928793643367960576",2017-11-10 02:17:15,2017-11-10,"I am leaving China for #APEC2017 in Vietnam. @FLOTUS Melania is staying behind to see the zoo, and of course, the Great WALL of China before going to Alaska to greet our AMAZING troops."
"927644826006425601",2017-11-06 22:12:15,2017-11-06,"The state of Virginia economy, under Democrat rule, has been terrible. If you vote Ed Gillespie tomorrow, it will come roaring back!"
"930744931609694208",2017-11-15 11:30:58,2017-11-15,"Our great country is respected again in Asia. You will see the fruits of our long but successful trip for many years to come!"
"930750650010480640",2017-11-15 11:53:42,2017-11-15,"Thank you, working hard! https://t.co/TmNdNPBJ3m"
"928279728125108225",2017-11-08 16:15:08,2017-11-08,"NoKo has interpreted America's past restraint as weakness. This would be a fatal miscalculation. Do not underestimate us. AND DO NOT TRY US. https://t.co/4llqLrNpK3"
"928922787938385920",2017-11-10 10:50:25,2017-11-10,"In more and more places throughout this region, citizens of SOVEREIGN and INDEPENDENT nations have taken greater control of their destinies, and unlocked the potential of their people. #APEC2017 https://t.co/a570IIGe0I"
"928098389966942208",2017-11-08 04:14:34,2017-11-08,"Anyone who doubts the strength or determination of the U.S. should look to our past....and you will doubt it no longer. https://t.co/zyuYc0fIH6"
"928074747316928513",2017-11-08 02:40:37,2017-11-08,"Ed Gillespie worked hard but did not embrace me or what I stand for. Don’t forget, Republicans won 4 out of 4 House seats, and with the economy doing record numbers, we will continue to win, even bigger than before!"
"927059219370643456",2017-11-05 07:25:16,2017-11-05,"Playing golf with Prime Minister Abe and Hideki Matsuyama, two wonderful people! https://t.co/vYLULe0o2K"
"930301344342265857",2017-11-14 06:08:19,2017-11-14,"Great to see @RandPaul looking well and back on the Senate floor. He will help us with TAX CUTS and REFORM!"
"928770248370728960",2017-11-10 00:44:17,2017-11-09,"My meetings with President Xi Jinping were very productive on both trade and the subject of North Korea. He is a highly respected and powerful representative of his people. It was great being with him and Madame Peng Liyuan!"
"927802776737984513",2017-11-07 08:39:54,2017-11-07,"It was my great honor to have lunch with our INCREDIBLE U.S. and ROK troops at Camp Humphreys, in South Korea. 🇺🇸🇰🇷 https://t.co/5NJirz4iNM https://t.co/kNLyONhBCC"
"930362633852735488",2017-11-14 10:11:51,2017-11-14,"THANK YOU to the amazing staff and their families of the United States Embassy in the Philippines. Keep up the GREAT WORK! https://t.co/3ABVXTsJM0"
"928016742575738882",2017-11-07 22:50:07,2017-11-07,"Thank you to all Americans who participated in Nat'l Rx Drug Take Back Day. A record amount of drugs collected &amp; disposed. We can do this!"
"927715648477724672",2017-11-07 02:53:41,2017-11-07,"RT @AbeShinzo: トランプ大統領による、初の、歴史的な日本訪問は、間違いなく、日米同盟の揺るぎない絆を世界に示すことができました。

本当にありがとう、ドナルド。そして、アジア歴訪の大成功をお祈りしています。

@realDonaldTrump https://t.…"
"926793510723796993",2017-11-04 13:49:26,2017-11-04,"Would very much appreciate Saudi Arabia doing their IPO of Aramco with the New York Stock Exchange. Important to the United States!"
"929717762422988801",2017-11-12 15:29:22,2017-11-12,"Thank you! https://t.co/TD0rYcWN8C"
"926647019455766528",2017-11-04 04:07:20,2017-11-04,"Thank you for such a beautiful welcome Hawaii. My great honor to visit @PacificCommand upon arrival. Heading to Pearl Harbor w/ @FLOTUS now. https://t.co/6gDME9cmnS"
"928097146993369088",2017-11-08 04:09:37,2017-11-08,"The U.S., under my administration, is completely rebuilding its military, and they're spending hundreds of billions of dollars to the newest and finest military equipment anywhere in the world, being built right now. I want peace through strength! https://t.co/2YXkIvRIFi"
"927007332743172098",2017-11-05 03:59:05,2017-11-05,"Just gave a speech to the great men and women at Yokota Air Base in Tokyo, Japan. Leaving to see Prime Minister Abe. https://t.co/6LRAgojvDB"
"926481563214376961",2017-11-03 17:09:52,2017-11-03,"The rigged Dem Primary, one of the biggest political stories in years, got ZERO coverage on Fake News Network TV last night. Disgraceful!"
"928918183104225280",2017-11-10 10:32:07,2017-11-10,"Throughout my travels, I've had the pleasure of sharing the good news from America. I've had the honor of sharing our vision for a free &amp; open Indo-Pacific -- a place where sovereign &amp; independent nations, w/diverse cultures &amp; many different dreams, can all prosper side-by-side. https://t.co/qBOCY3u7YV"
"926421589159182339",2017-11-03 13:11:33,2017-11-03,"...Based on that, the Military has hit ISIS ""much harder"" over the last two days. They will pay a big price for every attack on us!"
"927075137131896832",2017-11-05 08:28:31,2017-11-05,"It was a true honor to be at Yokota Air Base with our GREAT @USForcesJapan! https://t.co/KEXnIkkQks"
"927648870796070912",2017-11-06 22:28:20,2017-11-06,"Getting ready to leave for South Korea and meetings with President Moon, a fine gentleman. We will figure it all out!"
"928861178113040385",2017-11-10 06:45:36,2017-11-10,"Just landed in Da Nang, Vietnam to deliver a speech at #APEC2017"
"926789876556500992",2017-11-04 13:35:00,2017-11-04,"Unemployment is down to 4.1%, lowest in 17 years. 1.5 million new jobs created since I took office. Highest stock Market ever, up $5.4 trill"
"928105793366392832",2017-11-08 04:43:59,2017-11-08,"Together, we dream of a Korea that is free, a peninsula that is safe, and families that are reunited once again! https://t.co/9tsZRCC83j"
"926580912036466690",2017-11-03 23:44:39,2017-11-03,"Getting ready to land in Hawaii. Looking so much forward to meeting with our great Military/Veterans at Pearl Harbor!"
"929326786709807105",2017-11-11 13:35:46,2017-11-11,"“Presidential Proclamation Commemorating the 50th Anniversary of the Vietnam War” 
➡️https://t.co/hgUQP9leqK 
➡️https://t.co/9C0yyIv9Ws https://t.co/f9snmRUA4a"
"927851387857367040",2017-11-07 11:53:04,2017-11-07,"Ralph Northam will allow crime to be rampant in Virginia. He’s weak on crime, weak on our GREAT VETS, Anti-Second Amendment...."
"929320777668628480",2017-11-11 13:11:53,2017-11-11,"On this wonderful Veterans Day, I want to express the incredible gratitude of the entire American Nation to our GREAT VETERANS. Thank you! https://t.co/GhQbCA7yII"
"927847349648609280",2017-11-07 11:37:01,2017-11-07,"Stock market hit yet another all-time record high yesterday. There is great confidence in the moves that my Administration...."
"928969836897583104",2017-11-10 13:57:23,2017-11-10,"On behalf of an entire nation, Happy 242nd Birthday to the men and women of the United States Marines!
#USMC242 #SemperFi https://t.co/ecgoSJP5Uc"
"928931835664465921",2017-11-10 11:26:22,2017-11-10,"The United States is prepared to work with each of the leaders in this room today to achieve mutually beneficial commerce that is in the interests of both your countries and mine. That is the message I am here to deliver today. #APEC2017 https://t.co/CM3Hqt16A8"
"926456409260285952",2017-11-03 15:29:55,2017-11-03,"I always felt I would be running and winning against Bernie Sanders, not Crooked H, without cheating, I was right."
"930346433177378817",2017-11-14 09:07:29,2017-11-14,"One of the most accurate polls last time around. But #FakeNews likes to say we’re in the 30’s. They are wrong. Some people think numbers could be in the 50's. Together, WE will MAKE AMERICA GREAT AGAIN! https://t.co/YhrwkdObhP"
"928936220360503296",2017-11-10 11:43:48,2017-11-10,"The United States has been reminded time and again in recent years that economic security is not merely RELATED to national security - economic security IS national security. It is vital to our national strength. #APEC2017 https://t.co/8gKQUhit2X"
"929503025512693760",2017-11-12 01:16:05,2017-11-12,"Met with President Putin of Russia who was at #APEC meetings. Good discussions on Syria. Hope for his help to solve, along with China the dangerous North Korea crisis. Progress being made."
"923392161634275328",2017-10-26 05:33:41,2017-10-26,"Together, we will Make America Great Again!
#AmericaFirst🇺🇸 https://t.co/ajiC3flNkI"
"924382752941756421",2017-10-28 23:09:57,2017-10-28,"...addresses of any mentioned person who is still living. I am doing this for reasons of full disclosure, transparency and..."
"923557515828310020",2017-10-26 16:30:45,2017-10-26,"Do not underestimate the UNITY within the Republican Party!"
"923365521847934976",2017-10-26 03:47:50,2017-10-26,"This will be the biggest TAX CUT in the history of our country - and we need it! #TaxReform 
Read more: https://t.co/o3W9bJkz5k https://t.co/JYckXWEmLu"
"923866515358789633",2017-10-27 12:58:36,2017-10-27,"Wacky &amp; totally unhinged Tom Steyer, who has been fighting me and my Make America Great Again agenda from beginning, never wins elections!"
"923976737788227584",2017-10-27 20:16:35,2017-10-27,"We are inspired by the stories of everyday heroes who pull their communities from the depths of despair through leadership and love. https://t.co/DL3oan4Fm7"
"925833462426292226",2017-11-01 22:14:33,2017-11-01,"Thank you to the GREAT NYPD, First Responders and all govt officials for having handled the terrible West Side attack so professionally! https://t.co/imPIdOzjAn"
"926139726129704960",2017-11-02 18:31:32,2017-11-02,"Congratulations to the Houston @Astros, 2017 #WorldSeries Champions⚾️#HoustonStrong #EarnHistory https://t.co/BP7OEzdhFi"
"924414387343028224",2017-10-29 01:15:39,2017-10-28,"JFK Files are released, long ahead of schedule!"
"923876612013248512",2017-10-27 13:38:43,2017-10-27,"JFK Files are being carefully released. In the end there will be great transparency. It is my hope to get just about everything to public!"
"925373392827666432",2017-10-31 15:46:24,2017-10-31,"“Statement by President Trump on the Apprehension of Mustafa al-Imam for His Alleged Role in Benghazi Attacks” https://t.co/2U7WJmfGlM"
"923920535607828481",2017-10-27 16:33:15,2017-10-27,"Thank you @FLGovScott. https://t.co/rgdU9plvFK"
"926401530013642765",2017-11-03 11:51:51,2017-11-03,"My Twitter account was taken down for 11 minutes by a rogue employee. I guess the word must finally be getting out-and having an impact."
"925336826717593600",2017-10-31 13:21:06,2017-10-31,"I hope people will start to focus on our Massive Tax Cuts for Business (jobs) and the Middle Class (in addition to Democrat corruption)!"
"923925428372492288",2017-10-27 16:52:42,2017-10-27,"Diane Black of Tennessee, the highly respected House Budget Committee Chairwoman, did a GREAT job in passing Budget, setting up big Tax Cuts"
"924637600094326784",2017-10-29 15:02:37,2017-10-29,"...the Uranium to Russia deal, the  33,000 plus deleted Emails, the Comey fix and so much more. Instead they look at phony Trump/Russia,...."
"923869147091451904",2017-10-27 13:09:03,2017-10-27,"Congratulations to @SpeakerRyan, @GOPLeader, @SteveScalise and to the Republican Party on Budget passage yesterday. Now for biggest Tax Cuts"
"926216279287042048",2017-11-02 23:35:43,2017-11-02,"Today, it was my pleasure and great honor to announce my nomination of Jerome Powell to be the next Chairman of the @FederalReserve. https://t.co/6aDuRy3zws"
"923866849451888640",2017-10-27 12:59:56,2017-10-27,"Thank you @foxandfriends. Really great job and show!"
"926176823117074433",2017-11-02 20:58:56,2017-11-02,"Today, we are thrilled to welcome @Broadcom CEO Hock Tan to the WH to announce he is moving their HQ’s from Singapore back to the U.S.A..... https://t.co/WrqUXBndyZ"
"924625061100867584",2017-10-29 14:12:47,2017-10-29,"As usual, the ObamaCare premiums will be up (the Dems own it), but we will Repeal &amp; Replace and have great Healthcare soon after Tax Cuts!"
"923894747793580033",2017-10-27 14:50:47,2017-10-27,"Happy birthday to the great @TheLeeGreenwood. You and your beautiful song have made such a difference. MAKE AMERICA GREAT AGAIN!"
"926054936718307328",2017-11-02 12:54:36,2017-11-02,"...There is also something appropriate about keeping him in the home of the horrible crime he committed. Should move fast. DEATH PENALTY!"
"925424931390873602",2017-10-31 19:11:11,2017-10-31,"""Consumer Confidence Hits Highest Level Since December 2000"" Read more: https://t.co/w7WkcobFun https://t.co/nLo5XCnuIx"
"926260114146889728",2017-11-03 02:29:54,2017-11-03,"I will be interviewed by @IngrahamAngle on @FoxNews at 10:00. Enjoy!"
"926249604936556545",2017-11-03 01:48:09,2017-11-03,"....This is real collusion and dishonesty. Major violation of Campaign Finance Laws and Money Laundering - where is our Justice Department?"
"925363340553211909",2017-10-31 15:06:27,2017-10-31,"The biggest story yesterday, the one that has the Dems in a dither, is Podesta running from his firm. What he know about Crooked Dems is...."
"923905540291522560",2017-10-27 15:33:40,2017-10-27,"It is now commonly agreed, after many months of COSTLY looking, that there was NO collusion between Russia and Trump. Was collusion with HC!"
"925447637708496897",2017-10-31 20:41:25,2017-10-31,"U.S. COAL PRODUCTION
Up📈7.8% past year. 
Down📉31.5% last 10 years. 
#EndingWarOnCoal https://t.co/xr20OBb2DV"
"924382919845666816",2017-10-28 23:10:36,2017-10-28,"...in order to put any and all conspiracy theories to rest."
"925440868575797252",2017-10-31 20:14:31,2017-10-31,"“Home Prices Reach New All-Time Highs in August” Read more: https://t.co/XzJiZgGQ8R https://t.co/STBtR6mO2j"
"925006418989715456",2017-10-30 15:28:10,2017-10-30,"....Also, there is NO COLLUSION!"
"925931294705545216",2017-11-02 04:43:18,2017-11-02,"NYC terrorist was happy as he asked to hang ISIS flag in his hospital room. He killed 8 people, badly injured 12. SHOULD GET DEATH PENALTY!"
"925740081805217792",2017-11-01 16:03:29,2017-11-01,"....for the Middle Class. The House and Senate should consider ASAP as the process of final approval moves along. Push Biggest Tax Cuts EVER"
"925405818446663685",2017-10-31 17:55:14,2017-10-31,"RT @IvankaTrump: We're working to make tax cuts &amp; the expanded Child Tax Credit a reality for American families. The time is now! #TaxRefor…"
"924022268929433600",2017-10-27 23:17:31,2017-10-27,"People are anxiously awaiting my decision as to who the next head of the Fed will be....
🎥https://t.co/PEj1KNYcAO"
"926157911151214592",2017-11-02 19:43:47,2017-11-02,"Congress must end chain migration so that we can have a system that is SECURITY BASED! We need to make AMERICA SAFE! #USA🇺🇸 https://t.co/d7L1YW5iVY"
"925686558304464897",2017-11-01 12:30:48,2017-11-01,"We are fighting hard for Merit Based immigration, no more Democrat Lottery Systems. We must get MUCH tougher (and smarter).  @foxandfriends"
"926406490763784194",2017-11-03 12:11:33,2017-11-03,"....People are angry.  At some point the Justice Department, and the FBI, must do what is right and proper. The American public deserves it!"
"923360048771936256",2017-10-26 03:26:05,2017-10-26,"RT @IvankaTrump: Working families need #TaxReform &amp; the time is now. This Administration is committed to ensuring all Americans can thrive…"
"925916863401480192",2017-11-02 03:45:57,2017-11-02,"Happy birthday to @garyplayer, a truly great Champion and Person!"
"925388990177562625",2017-10-31 16:48:22,2017-10-31,"Thank you @LuisRiveraMarin! https://t.co/BK7sDv9phU"
"926259330474704900",2017-11-03 02:26:48,2017-11-03,"The @TuckerCarlson opening statement about our once cherished and great FBI was so sad to watch. James Comey's leadership was a disaster!"
"924251519121346560",2017-10-28 14:28:28,2017-10-28,"Just read the nice remarks by President Jimmy Carter about me and how badly I am treated by the press (Fake News). Thank you Mr. President!"
"923720632122200064",2017-10-27 03:18:55,2017-10-27,"WORKING TOGETHER, we will defeat this #OpioidEpidemic &amp; free our nation from the terrible affliction of drug abuse. https://t.co/iAZjqGMwav https://t.co/mZI5uQN4oZ"
"925913030159937537",2017-11-02 03:30:43,2017-11-02,"It is finally happening for our great clean coal miners! https://t.co/suAnjs6Ccz"
"924963492645437441",2017-10-30 12:37:36,2017-10-30,"Report out that Obama Campaign paid $972,000 to Fusion GPS. The firm also got $12,400,000 (really?) from DNC. Nobody knows who OK'd!"
"925333956110757888",2017-10-31 13:09:41,2017-10-31,"The Fake News is working overtime. As Paul Manaforts lawyer said, there was ""no collusion"" and events mentioned took place long before he..."
"924096747122634752",2017-10-28 04:13:28,2017-10-28,"“WHAT HAPPENED”

“How Team Hillary played the press for fools on Russia”
➡️https://t.co/GqpIidk017

NOW WE KNOW! https://t.co/SgWL1HZmkI"
"925818295462322184",2017-11-01 21:14:17,2017-11-01,"Just spoke with @NYGovCuomo and @NYCMayor de Blasio to let them know that the federal government..."
"926053970535243777",2017-11-02 12:50:46,2017-11-02,"Would love to send the NYC terrorist to Guantanamo but statistically that process takes much longer than going through the Federal system..."
"924649059520073730",2017-10-29 15:48:09,2017-10-29,"All of this ""Russia"" talk right when the Republicans are making their big push for historic Tax Cuts &amp; Reform. Is this coincidental? NOT!"
"924639422066384896",2017-10-29 15:09:51,2017-10-29,"...""collusion,"" which doesn't exist. The Dems are using this terrible (and bad for our country) Witch Hunt for evil politics, but the R's..."
"925845735089889280",2017-11-01 23:03:19,2017-11-01,"Thanks to @SenateMajLdr McConnell and the @SenateGOP we are appointing high-quality Federal District..."
"924056425298571265",2017-10-28 01:33:14,2017-10-27,"Happy Birthday @TheLeeGreenwood!
#FlashbackFriday https://t.co/MCrMK6Eurm"
"924064610038272000",2017-10-28 02:05:45,2017-10-28,"#JFKFiles https://t.co/AnPBSJFh3J"
