"id_str","datetime","date","text"
"890197095151546369",2017-07-26 15:08:21,2017-07-26,"....victory and cannot be burdened with the tremendous medical costs and disruption that transgender in the military would entail. Thank you"
"890208319566229504",2017-07-26 15:52:57,2017-07-26,"...big dollars ($700,000) for his wife's political run from Hillary Clinton and her representatives. Drain the Swamp!"
"889794300913045508",2017-07-25 12:27:47,2017-07-25,"Big day for HealthCare. After 7 years of talking, we will soon see whether or not Republicans are willing to step up to the plate!"
"891442016294494209",2017-07-30 01:35:13,2017-07-29,"...they do NOTHING for us with North Korea, just talk. We will no longer allow this to continue. China could easily solve this problem!"
"888711488717934592",2017-07-22 12:45:05,2017-07-22,"The Failing New York Times foiled U.S. attempt to kill the single most wanted terrorist,Al-Baghdadi.Their sick agenda over National Security"
"890554786755555329",2017-07-27 14:49:41,2017-07-27,"RT @townhallcom: ABC, NBC, And CBS Pretty Much Bury IT Scandal Engulfing Debbie Wasserman Schultz's Office https://t.co/PjbZ2TGIKb"
"890764622852173826",2017-07-28 04:43:30,2017-07-28,"Go Republican Senators, Go! Get there after waiting for 7 years. Give America great healthcare!"
"890705628716466176",2017-07-28 00:49:05,2017-07-27,"It was my great HONOR to present our nation's highest award for a public safety officer - THE MEDAL OF VALOR to FIVE AMERICAN HEROES! https://t.co/j7ceXuBZ3f"
"889438168721874944",2017-07-24 12:52:39,2017-07-24,"After 1 year of investigation with Zero evidence being found, Chuck Schumer just stated that ""Democrats should blame ourselves,not Russia."""
"891263843908947969",2017-07-29 13:47:13,2017-07-29,"If the Senate Democrats ever got the chance, they would switch to a 51 majority vote in first minute. They are laughing at R's. MAKE CHANGE!"
"890314337696579584",2017-07-26 22:54:14,2017-07-26,"Congratulations to Boys and Girls Nation. It was my great honor to welcome you to the WH today! Full Remarks: https://t.co/Pb5FTTOyWf https://t.co/U6tfV93dDG"
"890524387773997056",2017-07-27 12:48:53,2017-07-27,"Wow, the Failing @nytimes said about @foxandfriends ""....the most powerful T.V. show in America."""
"888727293346156546",2017-07-22 13:47:53,2017-07-22,"...What about all of the Clinton ties to Russia, including Podesta Company, Uranium deal, Russian Reset, big dollar speeches etc."
"890820505330212864",2017-07-28 08:25:33,2017-07-28,"3 Republicans and 48 Democrats let the American people down. As I said from the beginning, let ObamaCare implode, then deal. Watch!"
"889821674987761664",2017-07-25 14:16:34,2017-07-25,"Working on major Trade Deal with the United Kingdom. Could be very big &amp; exciting. JOBS! The E.U. is very protectionist with the U.S. STOP!"
"891998881009061888",2017-07-31 14:28:00,2017-07-31,"Highest Stock Market EVER, best economic numbers in years, unemployment lowest in 17 years, wages raising, border secure, S.C.: No WH chaos!"
"890968428370153472",2017-07-28 18:13:21,2017-07-28,"We will always ENFORCE our laws, PROTECT our borders, and SUPPORT our police! #LESM
Harrisburg, Pennsylvania 
#FlashbackFriday #MS13 https://t.co/79Tskiv69j"
"891437168798965761",2017-07-30 01:15:57,2017-07-29,"I love reading about all of the ""geniuses"" who were so instrumental in my election success. Problem is, most don't exist. #Fake News! MAGA"
"888733031875346432",2017-07-22 14:10:41,2017-07-22,"In all fairness to Anthony Scaramucci, he wanted to endorse me 1st, before the Republican Primaries started, but didn't think I was running!"
"889672374458646528",2017-07-25 04:23:18,2017-07-25,"The Amazon Washington Post fabricated the facts on my ending massive, dangerous, and wasteful payments to Syrian rebels fighting Assad....."
"888724194820857857",2017-07-22 13:35:34,2017-07-22,"While all agree the U. S. President has the complete power to pardon, why think of that when only crime so far is LEAKS against us.FAKE NEWS"
"891343645529567232",2017-07-29 19:04:20,2017-07-29,"U.S. Stock Market up almost 20% since Election!"
"888726438265966592",2017-07-22 13:44:29,2017-07-22,"So many people are asking why isn't the A.G. or Special Council looking at the many Hillary Clinton or Comey crimes. 33,000 e-mails deleted?"
"889790429398528000",2017-07-25 12:12:24,2017-07-25,"Attorney General Jeff Sessions has taken a VERY weak position on Hillary Clinton crimes (where are E-mails &amp; DNC server) &amp; Intel leakers!"
"889792764363276288",2017-07-25 12:21:41,2017-07-25,"Problem is that the acting head of the FBI &amp; the person in charge of the Hillary investigation, Andrew McCabe, got $700,000 from H for wife!"
"888730468732067841",2017-07-22 14:00:30,2017-07-22,"My son Donald openly gave his e-mails to the media &amp; authorities whereas Crooked Hillary Clinton deleted (&amp; acid washed) her 33,000 e-mails!"
"889435104841523201",2017-07-24 12:40:28,2017-07-24,"Drain the Swamp should be changed to Drain the Sewer - it's actually much worse than anyone ever thought, and it begins with the Fake News!"
"891253798500487168",2017-07-29 13:07:18,2017-07-29,"In other words, Russia was against Trump in the 2016 Election - and why not, I want strong military &amp; low oil prices. Witch Hunt! https://t.co/mMSxj4Su5z"
"890207082926022656",2017-07-26 15:48:02,2017-07-26,"Why didn't A.G. Sessions replace Acting FBI Director Andrew McCabe, a Comey friend who was in charge of Clinton investigation but got...."
"888734848550043648",2017-07-22 14:17:54,2017-07-22,"The Republican Senators must step up to the plate and, after 7 years, vote to Repeal and Replace. Next, Tax Reform and Infrastructure. WIN!"
"891397134662193152",2017-07-29 22:36:52,2017-07-29,"Unless the Republican Senators are total quitters, Repeal &amp; Replace is not dead! Demand another vote before voting on any other bill!"
"890069204082151424",2017-07-26 06:40:09,2017-07-26,"People of Ohio are fantastic. Thank you so much. What an evening! https://t.co/KM0zoaULYH"
"890566339462672385",2017-07-27 15:35:35,2017-07-27,"""One of the things that has been lost in the politics of this situation is that the Russians collected and spread negative information....."
"889925142675062784",2017-07-25 21:07:42,2017-07-25,"Joint Press Conference with Prime Minister Saad Hariri of Lebanon beginning shortly. Join us live!
➡️https://t.co/7pquWbEutn https://t.co/JHVHKgrPOY"
"890533442135502849",2017-07-27 13:24:52,2017-07-27,"Come on Republican Senators, you can do it on Healthcare. After 7 years, this is your chance to shine! Don't let the American people down!"
"891038014314598400",2017-07-28 22:49:51,2017-07-28,"I am pleased to inform you that I have just named General/Secretary John F Kelly as White House Chief of Staff. He is a Great American...."
"890931465885798400",2017-07-28 15:46:28,2017-07-28,"If Republicans are going to pass great future legislation in the Senate, they must immediately go to a 51 vote majority, not senseless 60..."
"889467610332528641",2017-07-24 14:49:38,2017-07-24,"So why aren't the Committees and investigators, and of course our beleaguered A.G., looking into Crooked Hillarys crimes &amp; Russia relations?"
"889579795176181761",2017-07-24 22:15:25,2017-07-24,"Arriving at Joint Base Andrews with @SecretaryPerry, @SecretaryZinke, and @SecPriceMD..... https://t.co/Yxm94XKtuv"
"889473486506385409",2017-07-24 15:12:59,2017-07-24,"Sleazy Adam Schiff, the totally biased Congressman looking into ""Russia,"" spends all of his time on television pushing the Dem loss excuse!"
"889474780356915206",2017-07-24 15:18:07,2017-07-24,"Republicans have a last chance to do the right thing on Repeal &amp; Replace after years of talking &amp; campaigning on it."
"888530948811366400",2017-07-22 00:47:40,2017-07-21,"Today, it was my privilege to welcome survivors of the #USSArizona to the @WhiteHouse. #HonorThem🇺🇸
Remarks: https://t.co/gySxxqazBl https://t.co/6IPmbqVi10"
"891996053611917312",2017-07-31 14:16:46,2017-07-31,"If ObamaCare is hurting people, &amp; it is, why shouldn't it hurt the insurance companies &amp; why should Congress not be paying what public pays?"
"892366646542782464",2017-08-01 14:49:22,2017-08-01,"Stock Market could hit all-time high (again) 22,000 today. Was 18,000 only 6 months ago on Election Day. Mainstream media seldom mentions!"
"888575966259314691",2017-07-22 03:46:33,2017-07-22,"Sean Spicer is a wonderful person who took tremendous abuse from the Fake News Media - but his future is bright!"
"889871789198802944",2017-07-25 17:35:42,2017-07-25,"""America's Labor Market Continues to Boom"" JOBS, JOBS, JOBS! https://t.co/LuOaR1Iz2e"
"891087485111087104",2017-07-29 02:06:26,2017-07-29,"We will defend our country, protect our communities and put the safety of the AMERICAN PEOPLE FIRST! Replay: https://t.co/dcZxPKOPZ9 https://t.co/0NGiIhGY18"
"891623821702295552",2017-07-30 13:37:39,2017-07-30,"Don't give up Republican Senators, the World is watching: Repeal &amp; Replace...and go to 51 votes (nuke option), get Cross State Lines &amp; more."
"889788202172780544",2017-07-25 12:03:33,2017-07-25,"Ukrainian efforts to sabotage Trump campaign - ""quietly working to boost Clinton."" So where is the investigation A.G. @seanhannity"
"889929412539543552",2017-07-25 21:24:40,2017-07-25,".@SenJohnMcCain-Thank you for coming to D.C. for such a vital vote. Congrats to all Rep. We can now deliver grt healthcare to all Americans!"
"888841724759597057",2017-07-22 21:22:35,2017-07-22,"A ship is only as good as the people who serve on it — and the AMERICAN SAILOR is the BEST in the world. @USNavy #USSGeraldRFord https://t.co/YmiTLXcCEh"
"889972487844491265",2017-07-26 00:15:50,2017-07-25,"Just arrived in Youngstown, Ohio with @FLOTUS Melania!
#MakeAmericaGreatAgain🇺🇸
🎥https://t.co/A1mrxSksR3 https://t.co/jWX9yBlX8z"
"890361489126805504",2017-07-27 02:01:35,2017-07-27,"Thank you Foxconn, for investing $10 BILLION DOLLARS with the potential for up to 13K new jobs in Wisconsin! MadeInTheUSA🇺🇸 https://t.co/jJghVeb63s"
"889654862379589633",2017-07-25 03:13:42,2017-07-25,"#2017Jambo- Remember your duty. Honor your history. Take care of the people God puts into your life – and LOVE &amp; CHERISH your country! https://t.co/DnNYxGJm4I"
"889675644396867584",2017-07-25 04:36:17,2017-07-25,"Is Fake News Washington Post being used as a lobbyist weapon against Congress to keep Politicians from looking into Amazon no-tax monopoly?"
"888771440014749697",2017-07-22 16:43:18,2017-07-22,"Join me live for the commissioning ceremony of the USS Gerald R. Ford!
➡️https://t.co/F78iOR64TW #USA https://t.co/PrVceEmPOB"
"891040645581873152",2017-07-28 23:00:19,2017-07-28,"I would like to thank Reince Priebus for his service and dedication to his country. We accomplished a lot together and I am proud of him!"
"890568797941362690",2017-07-27 15:45:22,2017-07-27,"...about then candidate Trump."" Catherine Herridge @FoxNews. So why doesn't Fake News report this? Witch Hunt! Purposely phony reporting."
"891334415347060736",2017-07-29 18:27:39,2017-07-29,"If a new HealthCare Bill is not approved quickly, BAILOUTS for Insurance Companies and BAILOUTS for Members of Congress will end very soon!"
"889274373689028609",2017-07-24 02:01:47,2017-07-24,"If Republicans don't Repeal and Replace the disastrous ObamaCare, the repercussions will be far greater than any of them understand!"
"891261878005092353",2017-07-29 13:39:25,2017-07-29,"....8 Dems totally control the U.S. Senate. Many great Republican bills will never pass, like Kate's Law and complete Healthcare. Get smart!"
"890935044474380288",2017-07-28 16:00:42,2017-07-28,"...Even though parts of healthcare could pass at 51, some really good things need 60. So many great future bills &amp; budgets need 60 votes...."
"891440474132795392",2017-07-30 01:29:05,2017-07-29,"I am very disappointed in China. Our foolish past leaders have allowed them to make hundreds of billions of dollars a year in trade, yet..."
"890196164313833472",2017-07-26 15:04:39,2017-07-26,"....Transgender individuals to  serve in any capacity in the U.S. Military. Our military must be focused on decisive and overwhelming....."
"889599425458327552",2017-07-24 23:33:25,2017-07-24,"Any senator who votes against starting debate is telling America that you are fine w/ the #OCareNightmare! 
Remarks: https://t.co/tSvWaMdxBA https://t.co/DI7e78hr6N"
"889824817473605632",2017-07-25 14:29:03,2017-07-25,"Will be traveling to the Great State of Ohio tonight. Big crowd expected. See you there!"
"890168183079960576",2017-07-26 13:13:28,2017-07-26,"Senator @lisamurkowski of the Great State of Alaska really let the Republicans, and our country, down yesterday. Too bad!"
"888736256145985536",2017-07-22 14:23:30,2017-07-22,"ObamaCare is dead and the Democrats are obstructionists, no ideas or votes, only obstruction. It is solely up to the 52 Republican Senators!"
"891332290474848257",2017-07-29 18:19:12,2017-07-29,"After seven years of ""talking"" Repeal &amp; Replace, the people of our great country are still being forced to live with imploding ObamaCare!"
"892147656319004672",2017-08-01 00:19:11,2017-07-31,"A great day at the White House!"
"889798407228989441",2017-07-25 12:44:06,2017-07-25,"So great that John McCain is coming back to vote. Brave - American hero! Thank you John."
"891999166074847232",2017-07-31 14:29:08,2017-07-31,"RT @foxandfriends: .@Suffolk_Sheriff praises President Trump for making gang eradication a priority https://t.co/uNY7jBhleE"
"890060370861334529",2017-07-26 06:05:03,2017-07-26,"It was my great honor to join our wonderful Veterans at AMVETS Post 44 in Youngstown, Ohio this evening. A grateful nation salutes you! https://t.co/RxobYHP1oR"
"889273320574783489",2017-07-24 01:57:36,2017-07-23,"It's hard to read the Failing New York Times or the Amazon Washington Post because every story/opinion, even if should be positive, is bad!"
"888713231065391104",2017-07-22 12:52:00,2017-07-22,"This morning I will be going to the Commissioning Ceremony for the largest aircraft carrier in the world, The Gerald R. Ford.  Norfolk, Va."
"890162144884514820",2017-07-26 12:49:28,2017-07-26,"The crowd in Ohio was amazing last night - broke all records. We all had a great time in a great State. Will be back soon!"
"890642377131515904",2017-07-27 20:37:44,2017-07-27,"Big progress being made in ridding our country of MS-13 gang members and gang members in general. MAKE AMERICA SAFE AGAIN!"
"885274148012011520",2017-07-13 01:06:19,2017-07-12,"Stock market hits another high with spirit and enthusiasm so positive. Jobs outlook looking very good! #MAGA🇺🇸 https://t.co/Vwxsb2vWGe"
"886691926233239556",2017-07-16 23:00:03,2017-07-16,"I am at the @USGA  #USWomensOpen. An amateur player is co-leading for the first time in many decades - very exciting!"
"883761448064864257",2017-07-08 20:55:23,2017-07-08,"Leaving Hamburg for Washington, D.C. and the WH. Just left China’s President Xi where we had an excellent meeting on trade &amp; North Korea."
"884027201804488704",2017-07-09 14:31:23,2017-07-09,"Sanctions were not discussed at my meeting with President Putin. Nothing will be done until the Ukrainian &amp; Syrian problems are solved!"
"886743367815766021",2017-07-17 02:24:28,2017-07-17,"Heading back to Washington, D.C. Much will be accomplished this week on trade, the military and security!"
"885772727315030020",2017-07-14 10:07:29,2017-07-14,"After all of these years of suffering thru ObamaCare, Republican Senators must come through as they have promised!"
"885772254017187840",2017-07-14 10:05:36,2017-07-14,"So impt Rep Senators, under leadership of @SenateMajLdr McConnell get healthcare plan approved. After 7yrs of O'Care disaster, must happen!"
"887477071160762369",2017-07-19 02:59:56,2017-07-19,"The Fake News is becoming more and more dishonest! Even a dinner arranged for top 20 leaders in Germany is made to look sinister!"
"885817217455140864",2017-07-14 13:04:16,2017-07-14,"It was a great honor to represent the United States at the magnificent #BastilleDay parade. Congratulations President @EmmanuelMacron! https://t.co/1J4vZiy98y"
"884728971530829824",2017-07-11 12:59:58,2017-07-11,"The Senate Democrats have only confirmed 48 of 197 Presidential Nominees. They  can't win so all they do is slow things down &amp; obstruct!"
"888088029428150272",2017-07-20 19:27:40,2017-07-20,"Departing The Pentagon after meetings with @VP Pence, Secretary James Mattis, and our great teams. #MAGA🇺🇸 https://t.co/5d1MSzhjQS"
"885109663217352704",2017-07-12 14:12:42,2017-07-12,".@WashTimes states ""Democrats have willfully used Moscow disinformation to influence the presidential election against Donald Trump."""
"885769944482414593",2017-07-14 09:56:26,2017-07-14,"Great evening with President @EmmanuelMacron &amp; Mrs. Macron. Went to Eiffel Tower for dinner. Relationship with France stronger than ever. https://t.co/ib1pdUYoEU"
"884379751665848322",2017-07-10 13:52:18,2017-07-10,"RT @seanhannity: HRC mishandles and destroys classified info-NO PROBLEM! Pay/play on Uranium one NO PROBLEM! Lynch BC tarmac: it's a ""matte…"
"886283456644251652",2017-07-15 19:56:57,2017-07-15,"Next week the Senate is going to vote on legislation to save Americans from the ObamaCare DISASTER. #WeeklyAddress🇺🇸 https://t.co/xjVDkgo1NK"
"885858247277727746",2017-07-14 15:47:19,2017-07-14,"Great conversations with President @EmmanuelMacron and his representatives on trade, military and security."
"886742955251335168",2017-07-17 02:22:50,2017-07-17,"Congratulations to Sung Hyun Park on winning the 2017 @USGA #USWomensOpen🇺🇸"
"887650824515661824",2017-07-19 14:30:22,2017-07-19,"I will be having lunch at the White House today with Republican Senators concerning healthcare. They MUST keep their promise to America!"
"885084555421634561",2017-07-12 12:32:56,2017-07-12,"Remember, when you hear the words ""sources say"" from the Fake Media, often times those sources are made up and do not exist."
"888240051599134721",2017-07-21 05:31:45,2017-07-21,"Billions of dollars in investments &amp; thousands of new jobs in America! An initiative via Corning, Merck &amp; Pfizer: https://t.co/QneN48bSiq https://t.co/5VtMfuY3PM"
"886262474277888002",2017-07-15 18:33:34,2017-07-15,"Will be at the Women's U.S. Open today!"
"884931352201756672",2017-07-12 02:24:10,2017-07-12,"My son, Donald, will be interviewed by @seanhannity tonight at 10:00 P.M. He is a great person who loves our country!"
"886950594220568576",2017-07-17 16:07:55,2017-07-17,"Most politicians would have gone to a meeting like the one Don jr attended in order to get info on an opponent. That's politics!"
"885232527656538113",2017-07-12 22:20:56,2017-07-12,"""After 14 years, U.S. beef hits Chinese market. Trade deal an exciting opportunity for agriculture."" https://t.co/gDGgejqFMs"
"885081181980590084",2017-07-12 12:19:32,2017-07-12,"My son Donald did a good job last night. He was open, transparent and innocent. This is the greatest Witch Hunt in political history. Sad!"
"885856351557210112",2017-07-14 15:39:47,2017-07-14,"The United States mourns for the victims of Nice, France. We pledge our solidarity with France against terror. 🇺🇸🇫🇷 https://t.co/7irbz08oT3"
"885086466061340674",2017-07-12 12:40:32,2017-07-12,"RT @foxandfriends: Getting the job done! Sen. Mitch McConnell delays August recess to work on health care bill https://t.co/wBjha8ldeK"
"884380352436985856",2017-07-10 13:54:41,2017-07-10,"RT @foxandfriends: Head of the NYPD union slams Mayor de Blasio for skipping vigil for assassinated cop Miosotis Familia https://t.co/nVWLb…"
"885266492765466625",2017-07-13 00:35:53,2017-07-12,"Getting rdy to leave for France @ the invitation of President Macron to celebrate &amp; honor Bastille Day and 100yrs since U.S. entry into WWI."
"888420461075476480",2017-07-21 17:28:38,2017-07-21,"""Six months in - it is the hope of GROWTH📈that is making America🇺🇸FOUR TRILLION DOLLARS💰RICHER."" -Stuart @VarneyCo
🎥https://t.co/s7fYOicWGV https://t.co/x9MeUzDom6"
"885275592681295872",2017-07-13 01:12:03,2017-07-12,"JOBS, JOBS, JOBS! #MAGA🇺🇸 https://t.co/HScS4Y9ZJK"
"884378624660582405",2017-07-10 13:47:49,2017-07-10,"If Chelsea Clinton were asked to hold the seat for her mother,as her mother gave our country away, the Fake News would say CHELSEA FOR PRES!"
"884726279014100992",2017-07-11 12:49:16,2017-07-11,"RT @foxandfriends: SEN. CRUZ: It's crazy to go an August recess without having Obamacare repealed. We should work every day until it is don…"
"886544734788997125",2017-07-16 13:15:10,2017-07-16,"With all of its phony unnamed sources &amp; highly slanted &amp; even fraudulent reporting, #Fake News is DISTORTING DEMOCRACY in our country!"
"883751888491098112",2017-07-08 20:17:24,2017-07-08,"We will fight the #FakeNews with you! https://t.co/zOMiXTeLJq"
"884359576996511745",2017-07-10 12:32:08,2017-07-10,"RT @foxandfriends: .@carriesheffield: The mainstream media is neglecting their duty to represent the public. They've failed to represent ha…"
"886534810575020032",2017-07-16 12:35:44,2017-07-16,"HillaryClinton can illegally get the questions to the Debate &amp; delete 33,000 emails but my son Don is being scorned by the Fake News Media?"
"883845492790235136",2017-07-09 02:29:21,2017-07-09,"Thank you @SenatorDole, very kind! https://t.co/cXrYiK46Qq"
"884374529660903424",2017-07-10 13:31:33,2017-07-10,"When I left Conference Room for short meetings with Japan and other countries, I asked Ivanka to hold seat. Very standard. Angela M agrees!"
"887134287350439936",2017-07-18 04:17:50,2017-07-18,"Republicans should just REPEAL failing ObamaCare now &amp; work on a new Healthcare Plan that will start from a clean slate. Dems will join in!"
"884211874518192128",2017-07-10 02:45:13,2017-07-10,"The fact that President Putin and I discussed a Cyber Security unit  doesn't mean I think it can happen. It can't-but a ceasefire can,&amp; did!"
"886259363412926464",2017-07-15 18:21:12,2017-07-15,"Stock Market at new all-time high! Working on new trade deals that will be great for U.S. and its workers!"
"886538703547621376",2017-07-16 12:51:12,2017-07-16,"Thank you to all of the supporters, who far out-numbered the protesters, yesterday at the Women's U.S. Open. Very cool!"
"885770227514052608",2017-07-14 09:57:33,2017-07-14,"Republicans Senators are working hard to get their failed ObamaCare replacement approved. I will be at my desk, pen in hand!"
"884141905436696576",2017-07-09 22:07:11,2017-07-09,"For years, even as a ""civilian,"" I listened as Republicans pushed the Repeal and Replace of ObamaCare. Now they finally have their chance!"
"887280380423938048",2017-07-18 13:58:22,2017-07-18,"As I have always said, let ObamaCare fail and then come together and do a great healthcare plan. Stay tuned!"
"888429879603191811",2017-07-21 18:06:04,2017-07-21,"ICYMI- This week we hosted a #MadeInAmerica event, right here at the @WhiteHouse! If it is MADE IN AMERICA, it is the BEST! USA🇺🇸 https://t.co/q4vB9GdE5y"
"885579818875670528",2017-07-13 21:20:56,2017-07-13,"Great bilateral meetings at Élysée Palace w/ President @EmmanuelMacron. The friendship between our two nations and ourselves is unbreakable. https://t.co/IOSoC0MdPv"
"885988016912838656",2017-07-15 00:22:58,2017-07-14,"Just landed from Paris, France. It was an incredible visit with President @EmmanuelMacron. A lot discussed and accomplished in two days!"
"883469033059864578",2017-07-08 01:33:26,2017-07-07,"Great first day with world leaders at the #G20Summit here in Hamburg, Germany. Looking forward to day two! #USA https://t.co/bLKgZKQemw"
"885131482397908992",2017-07-12 15:39:25,2017-07-12,"The W.H. is functioning perfectly, focused on HealthCare, Tax Cuts/Reform &amp; many other things. I have very little time for watching T.V."
"888393378970439682",2017-07-21 15:41:01,2017-07-21,"#MadeInAmerica🇺🇸
📸https://t.co/39dwlGHI7R https://t.co/VfIrc5Xssx"
"884013689736769536",2017-07-09 13:37:42,2017-07-09,"...We negotiated a ceasefire in parts of Syria which will save lives. Now it is time to move forward in working constructively with Russia!"
"884363456849342464",2017-07-10 12:47:33,2017-07-10,"I cannot imagine that Congress would dare to leave Washington without a beautiful new HealthCare bill fully approved and ready to go!"
"885865609971605508",2017-07-14 16:16:34,2017-07-14,"Left Paris for U.S.A. Will be heading to New Jersey and attending the
#USWomensOpen, their most important tournament, this afternoon."
"884360051808448512",2017-07-10 12:34:01,2017-07-10,"RT @foxandfriends: Report accuses material James Comey leaked to a friend contained top secret information https://t.co/Hkg4cAb6o9"
"885570979975639040",2017-07-13 20:45:49,2017-07-13,"President @EmmanuelMacron,
Thank you for the beautiful welcome ceremony at Les Invalides today! https://t.co/RKir1GcRrB"
"887302632687251456",2017-07-18 15:26:47,2017-07-18,"The Senate must go to a 51 vote majority instead of current 60 votes. Even parts of full Repeal need 60. 8 Dems control Senate. Crazy!"
"884361623514656769",2017-07-10 12:40:16,2017-07-10,"James Comey leaked CLASSIFIED INFORMATION to the media. That is so illegal!"
"884142582191849474",2017-07-09 22:09:52,2017-07-09,"Syrian ceasefire seems to be holding. Many lives can be saved. Came out of meeting. Good!"
"888128621784838144",2017-07-20 22:08:58,2017-07-20,"I am asking all citizens to believe in yourselves, believe in your future, and believe, once more, in America. #AmericaFirst🇺🇸 https://t.co/NOnhJyWp4J"
"885092844511387654",2017-07-12 13:05:53,2017-07-12,"ISIS is on the run &amp; will soon be wiped out of Syria &amp; Iraq, illegal border crossings are way down (75%) &amp; MS 13 gangs are being removed."
